Voyageurs	Minnesota 48°30′N 92°53′W﻿ / ﻿48.50°N 92.88°W﻿ / 48.50; -92.88﻿ (Voyageurs)	000000001971-01-08-0000January 8, 1971	This park protecting four lakes near the Canada–US border is a site for canoeing, kayaking, and fishing, and preserves a history populated by Ojibwe Native Americans, French fur traders called voyageurs, and ambitious gold-miners. Formed by glaciers, the region features tall bluffs, rock gardens, scenic islands and bays, and several historic buildings.[61]
Wind Cave	South Dakota 43°34′N 103°29′W﻿ / ﻿43.57°N 103.48°W﻿ / 43.57; -103.48﻿ (Wind Cave)	000000001903-01-09-0000January 9, 1903	Wind Cave is distinctive for its calcite fin formations called boxwork and needle-like growths called frostwork. Additionally, it is the world's densest and most complex cave system. Above ground is a mixed-grass prairie with animals such as bison, black-footed ferrets, and prairie dogs.[62] and ponderosa pine forests home to cougars and elk. It is culturally significant to the Lakota people as the site in which their emergence story takes place.
Wrangell–​St.&#160;Elias	Alaska 61°00′N 142°00′W﻿ / ﻿61.00°N 142.00°W﻿ / 61.00; -142.00﻿ (Wrangell – St. Elias)	000000001980-12-02-0000December 2, 1980	An immense plot of mountainous country protects the convergence of the Alaska, Chugach, and Wrangell-Saint Elias Ranges, which include many of the continent's tallest mountains and volcanoes, including the 18,008-foot Mount Saint Elias. More than a quarter of the park is covered with glaciers, including the tidewater Hubbard Glacier, piedmont Malaspina Glacier, and valley Nabesna Glacier.[63]
Yellowstone	Wyoming, Montana, Idaho 44°36′N 110°30′W﻿ / ﻿44.60°N 110.50°W﻿ / 44.60; -110.50﻿ (Yellowstone)	000000001872-03-01-0000March 1, 1872	Situated on the Yellowstone Caldera, the park has an expansive network of geothermal areas including vividly colored hot springs, boiling mud pots, and regularly erupting geysers, the best-known being Old Faithful and Grand Prismatic Spring. The yellow-hued Grand Canyon of the Yellowstone River has a number of scenic waterfalls, and four mountain ranges run through the park. More than 60 mammal species including gray wolves, grizzly bears, lynxes, bison, and elk, make this park one of the best wildlife viewing spots in the country.[64]
Yosemite	California 37°50′N 119°30′W﻿ / ﻿37.83°N 119.50°W﻿ / 37.83; -119.50﻿ (Yosemite)	000000001890-10-01-0000October 1, 1890	Among the earliest candidates for National Park status, Yosemite features towering granite cliffs, dramatic waterfalls, and old-growth forests at a unique intersection of geology and hydrology. Half Dome and El Capitan rise from the park's centerpiece, the glacier-carved Yosemite Valley, and from its vertical walls drop Yosemite Falls, North America's tallest waterfall. Three giant sequoia groves, along with a pristine wilderness in the heart of the Sierra Nevada, are home to an abundance of rare plant and animal species.[65]
Zion	Utah 37°18′N 113°03′W﻿ / ﻿37.30°N 113.05°W﻿ / 37.30; -113.05﻿ (Zion)	000000001919-11-19-0000November 19, 1919	Located at the junction of the Colorado Plateau, Great Basin, and Mojave Desert, this geological wonder has colorful sandstone canyons, mountainous mesas, and countless rock towers. Natural arches and exposed plateau formations compose a large wilderness roughly divided into four ecosystems: desert, riparian, woodland, and coniferous forest.[66]
